{
  "appId": "agavepy_sdk_wc-1.0.0",
  "archive": false,
  "archiveSystem": "test-storage-tacc-prod",
  "maxRunTime": "0:05:00",
  "inputs": {
    "input1": "agave://test-storage-tacc-prod/sd2etest/apps/agavepy_sdk_wc-1.0.0/example.txt"
  },
  "memoryPerNode": "1",
  "name": "agavepy_integration_test",
  "nodeCount": 1,
  "parameters": {},
  "processorsPerNode": 1
}
